Date,Sentence,Source
2020-10-13,"Analysts believe commodity prices have been recovering, which bodes well for the company. Meanwhile, what the company will do with $3.15 billion that it borrowed from the market to fund delisting will also be keenly watched.",Newsapi.org - The Times of India
2020-10-13,"Futures for Canada's main stock index rose on Tuesday after a long weekend, on higher oil prices which were boosted by positive trade data from China.",Newsapi.org - Reuters
2020-10-13,China’s trade growth accelerated in September as the world’s second-largest economy recovered from the coronavirus pandemic,Newsapi.org - ABC News
2020-10-13,"Judicial officials said they would set up special courts to prosecute those behind sanctions, though this would be a purely symbolic move.",Newsapi.org - Newsweek
2020-10-13,"Closing prices for crude oil, gold and other commodities, and foreign exchange levels",Newsapi.org - ABC News
2020-10-13,Xi Jinping is promising incentives for the tech hub of Shenzhen as China seeks to make its technology sector more self-reliant.,Newsapi.org - Australian Financial Review
2020-10-13,<p>Even some of the small businesses that make good money through the service file it under the category of ‘mixed blessing’</p>,Newsapi.org - Independent
2020-10-13,"Oil prices were steady in early trade on Tuesday, sitting on losses of nearly 3% from the previous session after supplies began to resume in Norway and the U.S. Gulf of Mexico and Libya resumed production at its largest oilfield.",Newsapi.org - Reuters
2020-10-13,"China, the world's top crude oil importer, took in 11.8 million barrels per day (bpd) of oil in September, up 5.5% from August and up 17.5% from September last year, customs data showed on Tuesday.",Newsapi.org - The Times of India
2020-10-13,Analysts said raising of bets by participants kept crude oil prices higher in futures trade.,Newsapi.org - The Times of India
2020-10-13,Analysts said widening of positions by traders mainly helped refined soya oil prices to trade higher in futures market.,Newsapi.org - The Times of India
2020-10-13,"Fabrique 1840 features goods made by the very finest artists, makers and creators across Canada. Shop now for giftable unique and exquisite high-quality items, including jewellry, handbags, furniture, kitchenware, skincare items and more.",Newsapi.org - CNN
2020-10-13,China’s trade picked up in September as exporters benefited from the country's relatively early reopening from pandemic shutdowns and strong global demand for masks and medical supplies,Newsapi.org - Independent
2020-10-13,"Summary List Placement

<ul>
<li>US stocks slipped on Tuesday as a stalemate in fiscal stimulus negotiations continued. </li>
<li>Initial results of the third-quarter earnings season kick off also failed to impress investors.</li>
<li>JPMorgan and Citigroup r…",Newsapi.org - Business Insider
2020-10-13,"Oil prices steady amid return of supply, while COVID-19 lockdowns tighten  Reuters India",Newsapi.org - Reuters
2020-10-13,"Summary List Placement

Seven months into the coronavirus pandemic, questions still remain around whether the economy is still headed for a V-shaped recovery.
Morgan Stanley's equity strategy team think it's a firm ""yes.""
Newly released economic data includin…",Newsapi.org - Business Insider
2020-10-13,"Renewable energy, led by solar power, could make up 80% of the growth in electricity generation over the next decade, according to a report published Tuesday.",Newsapi.org - CNN
2020-10-13,Protesters continue to call for reform across entire police system following allegations of police brutality.,Newsapi.org - Al Jazeera English
2020-10-13,"Amazon Prime Day has touched down in the UK, and with it comes incredible savings on tech gadgets, wardrobing essentials, health products, home decor and DIY tools.",Newsapi.org - CNN
2020-10-13,China’s trade growth accelerated in September as the world’s second-largest economy recovered from the coronavirus pandemic,Newsapi.org - Independent
2020-10-13,Saudi Prince and Putin Urge OPEC+ Compliance as Oil Prices Sag  Bloomberg,Newsapi.org - Bloomberg
2020-10-13,"Divergence between rich and poor is spiking as countries struggle with collapse in tourism, remittances and oil prices.",Newsapi.org - Al Jazeera English
2020-10-13,<p>Scientists say this decade is pivotal and that countries must rapidly convert to clean and renewable energy to get the climate crisis under control</p>,Newsapi.org - Independent
2020-10-13,"The return of supply comes as resurgent COVID-19 infections in the U.S. Midwest and Europe raise worries about fuel demand growth, posing a challenge for the Organization of Petroleum Exporting Countries and its allies, together called OPEC+.",Newsapi.org - The Times of India
2020-10-13,"But some analysts warn that demand for Chinese protective equipment is waning, possibly hurting future export growth.",Newsapi.org - Al Jazeera English
2020-10-13,China’s trade picked up in September as exporters benefited from the country's relatively early reopening from pandemic shutdowns and strong global demand for masks and medical supplies,Newsapi.org - ABC News
2020-10-14,Analysts said widening of positions by traders mainly helped refined soya oil prices to trade higher in futures market.,Newsapi.org - The Times of India
2020-10-14,"Oil prices strengthened on Wednesday, as OPEC and its allies were seen complying with a pact to cut oil supply in September, even as concerns loomed that recovery in fuel demand will be stalled by soaring global coronavirus cases.",Newsapi.org - Reuters
2020-10-14,"Closing prices for crude oil, gold and other commodities, and foreign exchange levels",Newsapi.org - ABC News
2020-10-14,"Oil prices were steady on Wednesday on concerns that fuel demand will continue to falter as rising coronavirus cases across Europe and in the United States, the world's biggest oil consumer, could impede economic growth.",Newsapi.org - Reuters
2020-10-14,How the COVID-19 pandemic is affecting every state,Newsapi.org - USA Today
2020-10-14,"In Pennsylvania, Trump and Biden are making frequent trips to areas that are home to fracking operations, such as Pittsburgh and Luzerne County.",Newsapi.org - USA Today
2020-10-14,"On ""Intelligence Matters,"" Mike Morell speaks with Wall Street Journal's Bradley Hope and Justin Scheck.",Newsapi.org - CBS News
2020-10-14,"Gold prices might continue to move with stocks for some time; demand for vacation homes has soared during the Covid-19 pandemic,  and lucky fans scored seats for the World Series at a steep discount.",Newsapi.org - The Wall Street Journal
2020-10-14,"The Organization of the Petroleum Exporting Countries (OPEC) said in its monthly report on Tuesday that oil demand in 2021 will rise by 6.54 million barrels per day (bpd) to 96.84 million bpd, 80,000 bpd less than its forecast a month ago, as a result of the …",Newsapi.org - The Times of India
2020-10-14,"Canada's main stock index rose on Wednesday, helped by energy stocks, as oil prices gained despite renewed fears about fuel demand recovery due to surging coronavirus cases.",Newsapi.org - Reuters
2020-10-14,Analysts said sell-off by participants at existing levels amid subdued trend in market mainly weighed on cottonseed oil cake prices.,Newsapi.org - The Times of India
2020-10-14,"Futures for Canada's main stock index fell on Wednesday, dragged by weakness in oil prices, as rising coronavirus cases around the globe stoked fuel-demand recovery concerns.",Newsapi.org - Reuters
2020-10-14,Oil prices edged down on Wednesday under pressure from growing concerns that a recovery in fuel demand will be stalled by soaring coronavirus cases around the world.,Newsapi.org - Reuters
2020-10-14,Tax increases and more user fees are two options included in a survey launched Wednesday by Alberta Finance Minister Travis Toews ahead of the 2021 provincial budget.,Newsapi.org - CBC News
2020-10-14,"Despite being in one of the worst recessions in recent history, home prices are rising across Canada. What’s going on? 
 
 
 
 
 
 This week on Down to Business, Benjamin Tal, deputy chief economist at CIBC, spoke about a report he authored earlier this month…",Newsapi.org - Financial Post
2020-10-14,"The former vice president and key Democrats in Congress want to use trade agreements to fight global warming, but reversing four years of Trump's ""energy dominance"" is no easy task.",Newsapi.org - Politico
2020-10-14,"U.S. oil producer ConocoPhillips is in talks to acquire shale producer Concho Resources Inc , Bloomberg News reported on Tuesday, citing people familiar with…",Newsapi.org - Financial Post
2020-10-14,"Oil prices were steady on Wednesday on concerns that fuel demand will continue to falter as rising coronavirus cases across Europe and in the United States, the world's biggest oil consumer, could impede economic growth.",Newsapi.org - Reuters
2020-10-14,"If the United States wants to stay ahead of China, it has to restore funding for basic R&D and create incentives for businesses to return to capital-intensive manufacturing investment.",Newsapi.org - Newsweek
2020-10-14,Shop our picks for the best Amazon Prime Day 2020 deals priced at $50 or less—get the details,Newsapi.org - USA Today
2020-10-14,"Crude oil prices are expected to trade under pressure as fading US stimulus hopes, demand growth worries and surge in virus cases will limit upside.",Newsapi.org - The Times of India
2020-10-14,We break down all the changes and innovations the Ford Mustang has undergone in its 56 years that have made it so iconic.,Newsapi.org - Business Insider
2020-10-14,"The judge's exchange on climate change was short, but her critics say it's disqualifying.",Newsapi.org - The Washington Post
2020-10-14,"Jeffrey Ubben, the former activist turned ethical investor, said on Tuesday that environmental, social and governance concerns will increasingly hit companies' stock prices, just as climate change hurt oil and gas companies' shares.",Newsapi.org - Reuters
2020-10-15,Analysts said sell-off by participants at existing levels amid subdued trend in market mainly weighed on cottonseed oil cake prices.,Newsapi.org - The Times of India
2020-10-15,"LONDON - The OPEC+ alliance will ensure oil prices do not plunge steeply again when it meets to set policy at the end of November, OPEC Secretary General Mohammad Barkindo said on Thursday.",Newsapi.org - Reuters
2020-10-15,"LONDON - The OPEC+ alliance will ensure oil prices do not plunge steeply again when it meets to set policy at the end of November, OPEC's Secretary General said on Thursday, adding that demand has been recovering more slowly than expected.",Newsapi.org - Reuters
2020-10-15,"OPEC+ will ensure oil prices do not plunge again, says OPEC chief  Reuters.com",Newsapi.org - Reuters
2020-10-15,Iraq's finance minister says there is growing political will to carry out drastic reforms needed for the country to tackle a daunting liquidity crisis that has pushed Iraq to the brink of collapse,Newsapi.org - Independent
2020-10-15,US Treasury Secretary Steven Mnuchin said a fiscal stimulus deal with rival Democrats is unlikely before elections.,Newsapi.org - Al Jazeera English
2020-10-15,"Canada's main stock index fell on Thursday, weighed down by energy stocks as oil prices slumped, while pot producer Aphria Inc's downbeat earnings further dented sentiment.",Newsapi.org - Reuters
2020-10-15,What the U.S. election means for countries around the globe.,Newsapi.org - The Washington Post
2020-10-15,"The Australian dollar falls on increased bets the Reserve Bank will cut interest rates in November, while global market sentiment took a hit from surging COVID-19 cases and the United States' inability to agree on stimulus deals.",Newsapi.org - ABC News (AU)
2020-10-15,"Covid infections are rising again in parts of the Middle East, posing a fresh threat to the region’s economies already battered by the collapse in oil prices.",Newsapi.org - Bloomberg
2020-10-15,"In the campaign’s final stretch, Trump wants to burnish an environmental record critics say is among the worst of any president.",Newsapi.org - The Washington Post
2020-10-15,"Gas prices spiked in 2012, the result of a number of factors. Social media posts claiming prices would soar with a Joe Biden victory are misleading.",Newsapi.org - USA Today
2020-10-15,"<p>Instead of Tehran, Biden has vowed to make Saudi Arabia ‘the pariah that they are’</p>",Newsapi.org - Independent
2020-10-15,Oil prices slipped over 2% on Thursday as new restrictions to stem a surge in COVID-19 infections increased uncertainty over the outlook for economic growth and a recovery in fuel demand.,Newsapi.org - Reuters
2020-10-15,"Closing prices for crude oil, gold and other commodities, and foreign exchange levels",Newsapi.org - ABC News
2020-10-15,"Oil prices edged higher on Thursday, extending their 2% gains from the previous session, after data showed U.S. crude stockpiles fell last week, while OPEC and its allies were seen complying with their pact to curb output in September.",Newsapi.org - Reuters
2020-10-15,Bullion prices are expected to trade in the current range with a bearish bias for the day.,Newsapi.org - The Times of India
2020-10-15,"Spending $12.6 billion of taxpayer funds to build a pipeline when private sector companies are adding more than enough capacity to meet the projected need is hard to justify, writes Thomas Gunton.",Newsapi.org - CBC News
2020-10-15,"CALGARY – The Alberta government is expected to resume land sales to oil and gas companies by the end of the year, but the plans are raising questions about whether the province will be able to secure the best value for its lease and licences in a bearish oil…",Newsapi.org - Financial Post
2020-10-15,"Stocks are opening lower on Wall Street, putting the market on track for its third straight loss this week",Newsapi.org - ABC News
2020-10-15,Oil prices fell on Thursday as new restrictions to stem a surge in COVID-19 infections have increased uncertainty over the outlook for economic growth and a recovery in fuel demand.,Newsapi.org - Reuters
2020-10-15,"Some European countries are reviving curfews and lockdowns to try to contain the rise in new coronavirus cases, with Britain expected to impose tougher COVID-19 restrictions on London from midnight on Friday.",Newsapi.org - The Times of India
2020-10-15,"The concept of adding more seats to the U.S. Supreme Court – or so-called “court packing” – has become a central part of the discussions in the weeks leading up to the presidential election, particularly with Vice President Joe Biden declining to address the …",Newsapi.org - Fox News
2020-10-15,"Methane emissions have jumped so far this year even as oil and gas production has been hit hard by the coronavirus pandemic.The report from Kayrros, which analyzes methane leaks through satellite...",Newsapi.org - The Hill
2020-10-15,Iraq's finance minister says there is growing political will to carry out drastic reforms needed for the country to tackle a daunting liquidity crisis that has pushed Iraq to the brink of collapse,Newsapi.org - ABC News
2020-10-15,New research shows conflicts rose in some countries but fell in others.,Newsapi.org - The Washington Post
2020-10-15,"""The energy markets are certainly marching to their own drummer at the moment,"" said Michael McCarthy, chief market strategist at CMC Markets and Stockbroking, adding that recent oil price volatility may have attracted more trader positions.",Newsapi.org - The Times of India
2020-10-15,Market analysts said cutting down of positions by participants against ample stocks mainly influenced refined soya oil prices.,Newsapi.org - The Times of India
2020-10-15,"""We have to be realistic that this recovery is not picking up pace at the rate that we expected earlier in the year,"" he said. ""Demand itself is still looking anaemic.""",Newsapi.org - The Times of India
2020-10-15,"Alberta’s shift away from coal power should be the most talked-about climate policy story in Canada today, according to Andrew Leach and Blake Shaffer.",Newsapi.org - CBC News
2020-10-16,S&P Global Ratings took Oman down to a B+ as lower crude revenue and the coronavirus pandemic hit country's finances.,Newsapi.org - Al Jazeera English
2020-10-16,"""The reality is that we're now seeing a pretty active spread of the pandemic across Europe and it's spreading again in North America, and that potentially will weigh on oil demand recovery,"" said Lachlan Shaw, head of commodity research at the National Bank o…",Newsapi.org - The Times of India
2020-10-16,Here is a look at how different commodities are behaving in today’s market.,Newsapi.org - The Times of India
2020-10-16,"Analysts and industry experts say the new policy has the potential to change the face of Indian agriculture, which has been hampered by low yields and inefficient smallholdings, by encouraging more contract farming.",Newsapi.org - The Times of India
2020-10-16,"Daily cases in the UK have risen steadily since August, leading to stricter restrictions beginning Friday night.",Newsapi.org - Business Insider
2020-10-16,"The south Asian country is the world's biggest importer of edible oils, and lower purchases of palm oil could weigh on Malaysian palm oil prices. Higher soyoil imports could support U.S. soyoil prices.",Newsapi.org - The Times of India
2020-10-16,"<p>Known more for port, these Portuguese wines are a wonderful example of the country’s modern and exciting winemaking, writes Terry Kirby</p>",Newsapi.org - Independent
2020-10-16,Analysts said widening of positions by traders mainly helped refined soya oil prices to trade higher in futures market.,Newsapi.org - The Times of India
2020-10-16,"Summary List Placement

Some day inflation is going to go up, probably. It might seem like a remote possibility, but it's one that professionals think investors need to prepare for today.
The key is that the Federal Reserve is open to letting inflation ""run h…",Newsapi.org - Business Insider
2020-10-16,"Closing prices for crude oil, gold and other commodities, and foreign exchange levels",Newsapi.org - ABC News
2020-10-16,"Tech investors could face brutal losses if regulators dismantle the companies and tax them more effectively, Smead said.",Newsapi.org - Business Insider
2020-10-16,U.S. energy firms this week added the most oil and natural gas rigs since January as producers return to the wellpad with crude prices holding around $40 a barrel over the past several months.,Newsapi.org - Reuters
2020-10-16,A green pivot will be a hard sell after four years of rolling back environmental rules.,Newsapi.org - The Washington Post
2020-10-16,Top oilfield services provider Schlumberger NV on Friday posted its third straight quarterly loss as this year's prolonged slump in oil prices due to the COVID-19 pandemic compelled its major energy customers to shun drilling.,Newsapi.org - Reuters
2020-10-16,Tech investors could suffer heavy losses if regulators dismantle the companies and tax them more effectively.,Newsapi.org - Business Insider
2020-10-17,"Amazon sale items to save on this weekend include 23andMe ancestry tests, All-Clad cookware and a Reviewed-approved diffuser—find out more.",Newsapi.org - USA Today
2020-10-17,"Natalia Aravena rushed down a small side street to escape, she recalls. Chile’s police force, the carabineros, were dispersing a protest near Santiago’s presidential palace on Oct. 28 2019, one of hundreds that broke out over inequality and the cost of living…",Newsapi.org - Time
2020-10-17,An uncertain scenario regarding oil prices owing to a resurgence of coronavirus cases leading to muted demand has cast a shadow on the country's finances.,Newsapi.org - The Times of India
2020-10-18,A women-run solar station near the front line in Abs is empowering its owners and improving life in their community.,Newsapi.org - Al Jazeera English
2020-10-18,"Why has India funked a big fiscal stimulus to stimulate the economy? The answer must be mainly political. The Prime Minister’s Office is clearly the driving force behind India’s fiscal conservatism. Most likely, the PMO...",Newsapi.org - The Times of India
2020-10-18,"Demand for Australian thermal coal has peaked, according to the International Energy Agency (IEA), and renewables will deliver 80 per cent of the world's energy needs in the next few years.",Newsapi.org - ABC News (AU)
2020-10-18,"With oil stuck at around $40, and more supply coming online from Libya, the cartel is now under pressure to revise its plan to ease those output cuts.",Newsapi.org - The Times of India
2020-10-18,Some of President Trump's and Joe Biden's key policies explained and compared.,Newsapi.org - BBC News
2020-10-19,Analysts said raising of bets by participants kept crude oil prices higher in futures trade.,Newsapi.org - The Times of India
2020-10-19,Analysts said widening of positions by traders mainly helped refined soya oil prices to trade higher in futures market.,Newsapi.org - The Times of India
2020-10-19,"It is one year (minus a day) until Calgarians head to the polls to vote for councillors, school trustees, a mayor — and likely some referendum questions. Watch live as CBC Calgary talks with civic leaders about the state of the city and its future.",Newsapi.org - CBC News
2020-10-19,"Last week, a bombshell survey indicated that nearly 60 percent of Scots would vote to quit the United Kingdom.",Newsapi.org - Al Jazeera English
2020-10-19,"The World Bank says the coronavirus pandemic and a collapse in oil prices have affected all aspects of the Middle East and North Africa, with the region’s economies projected to contract by 5.2% in 2020",Newsapi.org - ABC News
2020-10-19,"Oil prices edged up in early Asian trade on Monday ahead of China's economic growth data, which is expected to show recovery in the top oil importer, offsetting concerns of an impact from the virus' resurgence on consumption and rising supply.",Newsapi.org - Reuters
2020-10-19,US stocks lose their initial gains as global coronavirus infections climb to 40 million and negotiations over new stimulus spending to help the US economy make little headway as House Speaker Nancy Pelosi imposes deadline for a deal.,Newsapi.org - ABC News (AU)
2020-10-19,The governing United Conservative Party intends to introduce up to 20 pieces of legislation in the six-week fall legislature sitting which starts Tuesday.,Newsapi.org - CBC News
2020-10-19,"ConocoPhillips on Monday agreed to buy U.S. shale oil producer Concho Resources Inc for $9.7 billion, as the energy sector continued to consolidate amid lower fuel prices and demand.",Newsapi.org - Reuters
2020-10-19,"Higher oil prices are expected to bolster returns as Canadian energy companies report third-quarter results over the next few weeks, but observers say a recent stall in the crude price recovery and ongoing oil market uncertainty make increases in production a…",Newsapi.org - CBC News
2020-10-19,"ConocoPhillips <COP.N> said on Monday it will buy Permian-focused driller Concho Resources Inc <CXO.N> for $9.7 billion, the largest shale deal this year as oil and gas producers turn to consolidation to survive a slowdown in oil prices and demand.",Newsapi.org - Reuters
2020-10-19,Oilfield services provider Halliburton Co <HAL.N> on Monday posted its fourth consecutive quarterly loss as this year's slump in oil prices due to the COVID-19 pandemic hit demand for its services.,Newsapi.org - Reuters
2020-10-19,"Until we deliver a clear message to Vladimir Putin that there will be meaningful consequences for his government violating our sovereignty through election interference, Russia will not stop.",Newsapi.org - The Hill
2020-10-19,"Closing prices for crude oil, gold and other commodities, and foreign exchange levels",Newsapi.org - ABC News
2020-10-19,Another wave of the coronavirus could clobber crude demand and depress prices once again.,Newsapi.org - Al Jazeera English
2020-10-19,"Oil prices edged up in early Asian trade on Monday ahead of China's economic growth data, which is expected to show recovery in the top oil importer, offsetting concerns of an impact from the virus' resurgence on consumption and rising supply.",Newsapi.org - Reuters
2020-10-19,The clock is winding down on Washington to overcome its partisan differences and pass a new virus relief aid package.,Newsapi.org - Al Jazeera English
2020-10-19,"Brent rose 0.2% last week while WTI gained 0.7%, after crude and oil product inventories in the United States, world's top oil consumer, fell last week. However, last week's discussions at a panel of officials from the Organization of the Petroleum Exporting …",Newsapi.org - The Times of India
2020-10-19,The International Monetary Fund's latest report shows that the coronavirus pandemic has pushed nearly all Mideast nations into the throes of an economic recession this year,Newsapi.org - ABC News
2020-10-19,"The IMF expects Lebanon's economy to shrink 25 percent this year, one of the worst in MENA.",Newsapi.org - Al Jazeera English
2020-10-19,"Biden and Harris are right to be skeptical of calls to ban hydraulic fracturing, and the science on climate change backs them up.",Newsapi.org - Politico
2020-10-19,Here is a look at how different commodities are behaving in today’s market.,Newsapi.org - The Times of India
2020-10-19,The International Monetary Fund's latest report shows that the coronavirus pandemic has pushed nearly all Mideast nations into the throes of an economic recession this year,Newsapi.org - Independent
2020-10-19,"Halliburton Co <HAL.N> posted its fourth-straight quarterly loss on Monday, as the world's second-largest oilfield services provider struggles with a plunge in demand and lower oil prices.",Newsapi.org - Reuters
