Date,Sentence,Source
2020-10-07,Natural gas producer Cabot Oil & Gas Corp on Wednesday cut its full-year production outlook and said it would continue to evaluate options including temporarily forgoing production as gas prices remain weak.,Newsapi.org - Reuters
2020-10-07,"Kuwait's state news agency says that the deputy chief of the National Guard, who spent years in the oil-rich country’s security services, was nominated as crown prince",Newsapi.org - Independent
2020-10-07,"""Trump pulling out of relief negotiations generates a lot of uncertainty about the economy ... we also didn't get a constructive set of data in terms of oil consumption,"" said Harry Tchilinguirian, head of commodities research at BNP Paribas.",Newsapi.org - The Times of India
2020-10-07,"But Saudi Aramco plans to boost its production capacity so it can pump as much of Saudi Arabia's vast oil reserves when demand picks up - before a shift to cleaner energy makes crude all but worthless, industry sources and analysts told Reuters.",Newsapi.org - The Times of India
2020-10-07,"India will let companies producing gas from new local fields sell the cleaner fuel on e-bidding platforms, oil minister Dharmendra Pradhan said on Wednesday, in a move expected to help them get better prices and boost output.",Newsapi.org - Reuters
2020-10-07,"Summary List Placement

Exxon is having a bad week within a very tough year.
On Monday, the company announced job cuts in Europe, following previous reports of a voluntary redundancy program in Australia. The same day, the oil giant faced claims that its plan…",Newsapi.org - Business Insider
2020-10-07,"Summary List Placement

Big tech is getting ready to take on the House of Representatives.
The House Democrats on Tuesday dropped a 449-page report following a year-long antitrust investigation, laying out what they view as the monopoly power wielded by Apple…",Newsapi.org - Business Insider
2020-10-07,"S&P 500 futures wobbled either side of flat, finding some support from Trump tweets seeming to promise backing for individual pieces of fiscal stimulus. The dollar was steady at its highest level for the week so far. Oil prices slid and the strong dollar squa…",Newsapi.org - The Times of India
2020-10-07,"Kuwait's state news agency says that the deputy chief of the National Guard, who spent years in the oil-rich country’s security services, was nominated as crown prince",Newsapi.org - ABC News
2020-10-07,"Closing prices for crude oil, gold and other commodities, and foreign exchange levels",Newsapi.org - ABC News
2020-10-07,"U.S. West Texas Intermediate (WTI) crude oil futures fell 87 cents, or 2.1%, to $39.80 a barrel by 0104 GMT while Brent crude futures fell by 74 cents, or 1.7%, to $41.91 a barrel.",Newsapi.org - The Times of India
2020-10-07,Marketmen said raising of positions by participants amid a rising demand from cattle-feed makers mainly influenced cottonseed oil cake prices here.,Newsapi.org - The Times of India
2020-10-07,"Oil and gas prices are at record lows, so why is the Interior Department selling drilling leases as fast as it can?",Newsapi.org - Politico
2020-10-07,Asian shares opened lower but rebounded on optimism that the US is likely to pass new stimulus measures.,Newsapi.org - Al Jazeera English
2020-10-07,"The alphabet of letter shapes meant to describe how the economy pulls out of the COVID-19 recession has now added a K, which may mean we're not all in this together after all.",Newsapi.org - CBC News
2020-10-07,"""These firms have too much power, and that power must be reined in and subject to appropriate oversight and enforcement. Our economy and democracy are at stake,"" the report said.",Newsapi.org - Newsweek
2020-10-07,Stocks on Wall Street surge after the US President calls on Congress to pass some coronavirus relief measures including a bailout for airlines and stimulus cheques for individuals.,Newsapi.org - ABC News (AU)
2020-10-07,"The selection of Sheikh Meshaal, currently the deputy head of the National Guard, must be approved by the parliament.",Newsapi.org - Al Jazeera English
2020-10-07,Stocks are opening broadly higher on Wall Street Wednesday after President Donald Trump said he could be willing to sign off on specific aid measures for airlines and small businesses as well as another round of relief checks,Newsapi.org - ABC News
2020-10-07,Oil prices slipped on Wednesday after U.S. President Donald Trump dashed hopes for a fourth stimulus package to boost the coronavirus-hit economy and on a larger-than-expected build-up in U.S. crude stocks.,Newsapi.org - Reuters
2020-10-07,* Brazil real falls as Guedes says emergency budget ends this year * Mexico's investment plan viewed as positive by analysts * Chilean peso strengthens after higher copper prices * Oil exporter Colombia's peso hit by falling crude prices (Updates prices throu…,Newsapi.org - Reuters
2020-10-07,Oil prices slipped on Wednesday after U.S. President Donald Trump dashed hopes for a fourth stimulus package to boost the coronavirus-hit economy and on a larger-than-expected build-up in U.S. crude stocks.,Newsapi.org - Reuters
2020-10-07,"The Australian share market gains ground after Donald Trump calls on Congress to pass some coronavirus relief measures, while iSelect admits deceiving consumers about power plans.",Newsapi.org - ABC News (AU)
2020-10-07,Oil prices slipped on Wednesday after U.S. President Donald Trump dashed hopes for a fourth stimulus package to boost the coronavirus-hit economy and on a larger-than-expected build-up in U.S. crude stocks.,Newsapi.org - Reuters
2020-10-07,Oil prices slipped on Wednesday after U.S. President Donald Trump dashed hopes for a fourth stimulus package to boost the coronavirus-hit economy and on a larger-than-expected build-up in U.S. crude stocks.,Newsapi.org - Reuters
2020-10-07,"Once the nation's largest company, Exxon's market value has fallen more than 50% since the start of the year.",Newsapi.org - Business Insider
2020-10-07,Analysts said widening of positions by traders mainly helped refined soya oil prices to trade higher in futures market.,Newsapi.org - The Times of India
2020-10-07,* Brazil real falls as Guedes says emergency budget ends this year * Mexico's investment plan viewed as positive by analysts * Chilean peso strengthens after higher copper prices * Oil exporter Colombia's peso hit by falling crude prices (Updates prices throu…,Newsapi.org - Reuters
2020-10-07,The Government Accountability Office said officials flouted their own goals when giving struggling petroleum producers a break this spring on payments.,Newsapi.org - The Washington Post
2020-10-07,,Newsapi.org - Bloomberg
2020-10-07,Stocks are opening broadly higher on Wall Street Wednesday after President Donald Trump said he could be willing to sign off on specific aid measures for airlines and small businesses as well as another round of relief checks,Newsapi.org - Independent
2020-10-07,"Oil prices and US petrol futures rose, boosted by shut-ins ahead of Hurricane Delta.",Newsapi.org - Al Jazeera English
2020-10-07,This Wednesday's best Amazon sale items  include early Prime Day 2020 price drops on the Echo Show 5 and a Shark robot vacuum—see more.,Newsapi.org - USA Today
2020-10-08,"OPEC sees oil demand peaking by the late 2030s, in contrast to oil industry view that plateau will happen sooner.",Newsapi.org - Al Jazeera English
2020-10-08,"US investors are optimistic about more coronavirus stimulus as Donald Trump repeats calls for standalone aid, although US House Speaker Nancy Pelosi is pushing for a $US2 trillion comprehensive package.",Newsapi.org - ABC News (AU)
2020-10-08,"One of Asia's biggest asphalt companies is helping Venezuela skirt harsh U.S. sanctions by moving hundreds of millions of dollars on behalf of the state-run oil company PDVSA, according to an Associated Press investigation",Newsapi.org - ABC News
2020-10-08,Analysts said widening of positions by traders mainly helped refined soya oil prices to trade higher in futures market.,Newsapi.org - The Times of India
2020-10-08,"Oil prices rose on Thursday as oil workers evacuated rigs in the U.S. Gulf of Mexico ahead of Hurricane Delta, though fuel demand concerns persisted on fading chances for an economic stimulus deal in the United States, the world's biggest oil consumer.",Newsapi.org - Reuters
2020-10-08,"Kuwait’s new crown prince has taken the oath of office, ascending to the post after the country’s parliament unanimously approved the ruling emir’s choice of successor",Newsapi.org - ABC News
2020-10-08,"One of Asia’s biggest asphalt companies is helping Venezuela skirt harsh U.S. sanctions by moving hundreds of millions of dollars on behalf of the state-run oil company PDVSA, according to an Associated Press investigation",Newsapi.org - ABC News
2020-10-08,Kuwait's new crown prince pledges commitment to democracyThe assembly unanimously endorsed the octogenarian Sheikh Meshal for the role in what has been a smooth succession that retained power firmly within the ruling family's oldest ranks following last week'…,Newsapi.org - The Times of India
2020-10-08,"One of Asia's biggest asphalt companies is helping Venezuela skirt harsh U.S. sanctions by moving hundreds of millions of dollars on behalf of the state-run oil company PDVSA, according to an Associated Press investigation",Newsapi.org - Independent
2020-10-08,,Newsapi.org - Politico
2020-10-08,"Oil prices rose on Thursday as oil workers evacuated rigs in the U.S. Gulf of Mexico ahead of Hurricane Delta, though fuel demand concerns persisted on fading chances for an economic stimulus deal in the United States, the world's biggest oil consumer.",Newsapi.org - Reuters
2020-10-08,"Alberta's economy continues to sputter and isn't expected to exceed pre-pandemic levels until 2023, according to the latest forecast from ATB Financial.",Newsapi.org - CBC News
2020-10-08,The oil and gas industry is laying off workers at an unprecedented pace to cope with a pandemic that crashed energy prices and raised doubts about the future of fossil fuels.,Newsapi.org - CNN
2020-10-08,"Closing prices for crude oil, gold and other commodities, and foreign exchange levels",Newsapi.org - ABC News
2020-10-08,"(Adds strategist quotes and details throughout, updates prices) * Canadian dollar rises 0.4% against the greenback * Loonie touches its strongest since Sept. 21 at 1.3198 * Canadian housing starts fall 20% in September * Canadian bond yields ease across much …",Newsapi.org - Reuters
2020-10-08,"(Adds strategist quotes and details throughout, updates prices) * Canadian dollar rises 0.4% against the greenback * Loonie touches its strongest since Sept. 21 at 1.3198 * Canadian housing starts fall 20% in September * Canadian bond yields ease across much …",Newsapi.org - Reuters
2020-10-08,"After saying he is halting talks with Democrats over fiscal stimulus bill, Trump said he will back targeted measures.",Newsapi.org - Al Jazeera English
2020-10-08,Analysts say Kuwait's Emir Sheikh Nawaf may delegate a larger portion of responsibilities to the new crown prince.,Newsapi.org - Al Jazeera English
2020-10-08,"One of Asia’s biggest asphalt companies is helping Venezuela skirt harsh U.S. sanctions by moving hundreds of millions of dollars on behalf of the state-run oil company PDVSA, according to an Associated Press investigation",Newsapi.org - Independent
2020-10-08,"Kuwait’s new crown prince has taken the oath of office, ascending to the post after the country’s parliament unanimously approved the ruling emir’s choice of successor",Newsapi.org - Independent
2020-10-08,"You can still gift someone something great for under $25 like a cold brew coffee maker, the Tile Mate, a waffle maker, and more.",Newsapi.org - USA Today
2020-10-08,"Summary List Placement

<ul>
<li>US stocks gained on Thursday amid revived hopes for near-term stimulus and jobless claims that declined week-over-week.</li>
<li>President Donald Trump indicated in a late Tuesday tweet that he backs a piecemeal strategy for p…",Newsapi.org - Business Insider
2020-10-08,"The big tech companies may be relatively new, but their monopolistic practices aren’t unique. Neither are the solutions to the problems they create.",Newsapi.org - The Washington Post
2020-10-08,"With Hurricane Delta forecast to intensify into a Category 3 storm with winds of up to 120 miles per hour (193 km per hour), oil producers have evacuated 183 offshore facilities and halted nearly 1.5 million barrels per day (bpd) of oil output.",Newsapi.org - The Times of India
2020-10-08,Here's our roundup of 15 suspect claims uttered during the debate between Vice President Pence and Sen. Kamala D. Harris,Newsapi.org - The Washington Post
2020-10-08,Marketmen said raising of positions by participants amid a rising demand from cattle-feed makers mainly influenced cottonseed oil cake prices here.,Newsapi.org - The Times of India
2020-10-09,Alberta’s energy minister is unconcerned about a new report by the Organization of the Petroleum Exporting Countries (OPEC) that suggests demand for oil will plateau in a decade.,Newsapi.org - CBC News
2020-10-09,"It took only hours for September’s sparkling job numbers to become yesterday’s news. 
 
 
 
 
 
 Statistics Canada 
 
 
 
 
 
 reported
 
 
 
 
 
  Friday morning that employment had jumped by a greater-than-expected 378,000 positions last month. The jobless …",Newsapi.org - Financial Post
2020-10-09,Following are the highlights of RBI Governor Shaktikanta Das' statement and resolution of the Monetary Policy Committee (MPC).,Newsapi.org - The Times of India
2020-10-09,Asian stock markets have followed Wall Street higher on hopes Washington will provide more aid to the U.S. economy,Newsapi.org - Independent
2020-10-09,Brent was down 31 cents at $43.03 a barrel by 1219 GMT. U.S. West Texas Intermediate (WTI) crude fell 34 cents to $40.85.,Newsapi.org - The Times of India
2020-10-09,Asian stock markets have followed Wall Street higher on hopes Washington will provide more aid to the U.S. economy,Newsapi.org - ABC News
2020-10-09,"* Dollar, yen sold this week as stimulus hopes boost mood * Stimulus seen coming regardless of U.S. election result * 10% gain in oil prices this week lifts oil exporters' currencies * Graphic: World FX rates in 2020 https://tmsnrt.rs/2RBWI5E By Tom Westbrook…",Newsapi.org - Reuters
2020-10-09,"Oil prices fell on Friday, erasing earlier gains but still leaving both benchmarks on track for their biggest weekly gains since early June.",Newsapi.org - Reuters
2020-10-09,Oil prices eased a few cents early in trading on Friday in a breather at the end of a week of big gains propelled by a strike in Norway that raised the prospect of supply from the major producer being slashed by up to 25%.,Newsapi.org - Reuters
2020-10-09,Widening lead by Democratic challenger to Trump in US election lowers risk of a contested result and market volatility.,Newsapi.org - Al Jazeera English
2020-10-09,"Palm oil prices are likely to jump in the first half of 2021, three leading industry analysts said in a webinar on Thursday, as La Nina weather pattern is set to hit edible oil supplies amid lower soybean crushing in Argentina and rising sunflower oil prices.",Newsapi.org - Reuters
2020-10-09,Marketmen said raising of positions by participants amid a rising demand from cattle-feed makers mainly influenced cottonseed oil cake prices here.,Newsapi.org - The Times of India
2020-10-09,Oil prices eased a few cents early in trading on Friday in a breather at the end of a week of big gains propelled by a strike in Norway that raised the prospect of supply from the major producer being slashed by up to 25%.,Newsapi.org - Reuters
2020-10-09,"With Hurricane Delta bearing down on Louisiana and Texas, the nation’s oil producers are battening down the hatches. But there's a bigger storm on the horizon for America's fossil fuel industry.",Newsapi.org - NBC News
2020-10-09,Oil prices eased a few cents early in trading on Friday in a breather at the end of a week of big gains propelled by a strike in Norway that raised the prospect of supply from the major producer being slashed by up to 25%.,Newsapi.org - Reuters
2020-10-09,"WSJ Wealth Adviser Briefing: Exxon Turbo Boost, Tech Buyout Fantasies, Stashing Cash  The Wall Street Journal",Newsapi.org - The Wall Street Journal
2020-10-09,"Oil prices eased on Friday, slipping at the end of a week of big gains made on the risk that supplies from Norway could be slashed by up to 25% due to a strike by oilworkers.",Newsapi.org - Reuters
2020-10-09,Analysts said widening of positions by traders mainly helped refined soya oil prices to trade higher in futures market.,Newsapi.org - The Times of India
2020-10-09,"<p>‘Mr President, two hours. I know you’ve got a jam-packed day,’ radio host said as he gave Trump the hook. Only it sure didn’t seem that way</p>",Newsapi.org - Independent
2020-10-09,"Closing prices for crude oil, gold and other commodities, and foreign exchange levels",Newsapi.org - ABC News
2020-10-09,Both contracts are on track for gains of around 10% this week - the first rise in three weeks - yanked higher by the prospect of tighter supply on production outages in the North Sea because of the action by Norwegian oil workers.,Newsapi.org - The Times of India
2020-10-09,"Welcome to Insider Energy, Business Insider's weekly energy newsletter. Sign up to get it in your inbox every Friday.",Newsapi.org - Business Insider
2020-10-09,10 things you need to know before the opening bell,Newsapi.org - Business Insider
2020-10-09,"Higher crude prices could magnify Exxon's chemicals segment’s earnings; tech giants probably won’t be able to buy their way to growth anytime soon, and figuring out where is the best place to store cash.",Newsapi.org - The Wall Street Journal
2020-10-10,Virginia's watchdog agency has found that the executive director of a state economic development commission bent the rules when he forgave a six-figure grant that should have been repaid by a politically connected developer,Newsapi.org - Independent
2020-10-10,"Summary List Placement

The FTSE 100, the UK stock index that tracks the biggest 100 companies on the London Stock Exchange, was one of the worst-performing major indexes in Europe in September.
UK assets were hit hard due to a surge in COVID-19 cases in Brit…",Newsapi.org - Business Insider
2020-10-10,Virginia's watchdog agency has found that the executive director of a state economic development commission bent the rules when he forgave a six-figure grant that should have been repaid by a politically connected developer,Newsapi.org - ABC News
2020-10-10,The coronavirus may have sidelined President Donald Trump over the past week but it didn't silence him,Newsapi.org - Independent
2020-10-10,The coronavirus may have sidelined President Donald Trump over the past week but it didn't silence him,Newsapi.org - ABC News
2020-10-11,"For this horrible year, the International Energy Agency sees global oil demand 8.4 million barrels a day lower than it was in 2019.",Newsapi.org - The Times of India
2020-10-11,There's hope around the oil-and-gas sector that the arrival of a normal winter could bring some much-needed stability for Alberta's natural gas producers.,Newsapi.org - CBC News
2020-10-11,"Saudi Arabia’s National Commercial Bank says it will purchase rival lender Samba Financial Group in a deal valued at $14.8 billion, creating what will become the kingdom’s largest bank",Newsapi.org - Independent
2020-10-11,"Iraq’s Oil Minister Ihsan Abdul Jabbar said oil prices are expected to reach around $45 in the first quarter of 2021, the al-Sabah state newspaper reported on Sunday.",Newsapi.org - Reuters
2020-10-11,"​Motilal Oswal expects Wipro to report a 4.1 per cent decline in September quarter net profit from a year ago, while it may have risen 1.8 per cent from the quarter before.",Newsapi.org - The Times of India
2020-10-11,"<ol><li>Oil Falls Below $40 With Supply Constraints Beginning to Ease  Bloomberg
</li><li>Oil prices extend slide as U.S. producers restore output post-hurricane  Investing.com
</li><li>Fear of Crude Oil Market being Saturated Lingers on  FX Empire
</li><l…",Newsapi.org - Bloomberg
2020-10-11,"Saudi Arabia’s National Commercial Bank says it will purchase rival lender Samba Financial Group in a deal valued at $14.8 billion, creating what will become the kingdom’s largest bank",Newsapi.org - ABC News
2020-10-11,"""We recommend investors stay in the market, position for the upside in equities, and use volatility to build long term positions,"" UBS said.",Newsapi.org - Business Insider
2020-10-11,"<ol><li>Oil Slides Below $40 With Supply Disruptions Subsiding  Bloomberg
</li><li>What Is Slowing The Oil Market Recovery  OilPrice.com
</li><li>Libya Reopens Biggest Oil Field, Giving OPEC+ a New Headache  Yahoo Canada Finance
</li><li>Oil prices extend …",Newsapi.org - Bloomberg
2020-10-11,The average U.S. price of regular-grade gasoline fell half a penny over the past two weeks to just under $2.25 per gallon,Newsapi.org - ABC News
2020-10-12,"""It's all about ending production disruptions ... (which) are not helpful in a period with ongoing demand concerns,"" said UBS oil analyst Giovanni Staunovo.",Newsapi.org - The Times of India
2020-10-12,Oman is to start levying a 5 percent VAT in six months as the country seeks to shore up state finances during pandemic.,Newsapi.org - Al Jazeera English
2020-10-12,"It said that in the past week, soybean and soy oil prices have risen sharply, because of which farmers have stopped bringing their produce to the market.",Newsapi.org - The Times of India
2020-10-12,"After eight-day holiday, Chinese investors are encouraged by strong rebound in tourism and fall in coronavirus cases.",Newsapi.org - Al Jazeera English
2020-10-12,"Closing prices for crude oil, gold and other commodities, and foreign exchange levels",Newsapi.org - ABC News
2020-10-12,Traders are buying shares of green-energy companies and gauging the impact of possible corporate-tax increases as they prepare for a potential Biden win,Newsapi.org - The Wall Street Journal
2020-10-12,"It's been five years since Israel signed a landmark agreement to develop large offshore gas fields over the objections of antitrust authorities, environmentalists and consumer advocates",Newsapi.org - ABC News
2020-10-12,"<p>It's been five years since Israel signed a landmark agreement to develop large offshore gas fields over the objections of antitrust authorities, environmentalists and consumer advocates</p>",Newsapi.org - Independent
2020-10-12,"Goldman reiterated its bullish 2021 view for both natural gas and oil, saying drivers for higher prices supersede the potential outcomes of the U.S. election.",Newsapi.org - The Times of India
2020-10-12,"It's been five years since Israel signed a landmark agreement to develop large offshore gas fields over the objections of antitrust authorities, environmentalists and consumer advocates",Newsapi.org - Independent
2020-10-12,"Impatient to return to the campaign trail, President Donald Trump made a series of claims over the weekend about his health and the course of the pandemic",Newsapi.org - Independent
2020-10-12,Google's merger with a travel software company made it a travel leader. It was just one of the many times the company has been reviewed by the feds.,Newsapi.org - The Washington Post
2020-10-12,"Impatient to return to the campaign trail, President Donald Trump made a series of claims over the weekend about his health and the course of the pandemic",Newsapi.org - Independent
2020-10-12,"CORRECTED-UPDATE 7-Oil prices fall 3% as US, Libyan, Norwegian supplies resume  Reuters UK",Newsapi.org - Reuters
2020-10-12,"It's been five years since Israel signed a landmark agreement to develop large offshore gas fields over the objections of antitrust authorities, environmentalists and consumer advocates",Newsapi.org - ABC News
2020-10-12,"Brent crude for December fell 55 cents, or 1.3 per cent, to $42.30 a barrel by 0023 GMT and U.S. West Texas Intermediate for November was at $40.08 a barrel, down 52 cents, or 1.3 per cent.",Newsapi.org - The Times of India
2020-10-12,"Not everyone wants an oil recovery, writes contributor Lori Lee Oates, who instead calls on politicians to focus on climate change and the damage of fossil fuels.",Newsapi.org - CBC News
2020-10-12,"The bank will control some USD 223 billion in assets and a market capitalisation of USD 46 billion after the merger wins regulatory approvals and is completed, National Commercial Bank said in a filing on Riyadh's Tadawul stock market announcing the deal. The…",Newsapi.org - The Times of India
2020-10-12,"Impatient to return to the campaign trail, President Donald Trump made a series of claims over the weekend about his health and the course of the pandemic",Newsapi.org - ABC News
2020-10-12,"Australian shares are likely to rise above their seven-week high, as a tech rally and expectations of COVID-19 stimulus boost Wall Street.",Newsapi.org - ABC News (AU)
2020-10-12,"The UAE permitted the federal government to begin issuing sovereign debt in 2018, which is usually sold by individual emirates.",Newsapi.org - The Times of India
2020-10-12,"Products like a portable phone charger, fuzzy socks, cloth face masks will all make great stocking stuffers this year.",Newsapi.org - USA Today
2020-10-12,"Americans living in ""Cancer Alley"" suffer from high rates of cancer. In this six-part series, USA TODAY investigates how racism fuels COVID-19 deaths.",Newsapi.org - USA Today
2020-10-12,"Stocks were pushing higher on Wall Street in afternoon trading Monday and tacking more gains onto last week's market rally, its best in three months.",Newsapi.org - CBC News
